{
  "schema": "ardyn.phase-5.79.ci-enablement-boundary-map-result",
  "schemaVersion": "0.1.0",
  "ciEnablementKind": "ci-enablement-boundary-map",
  "ciEnablementMode": "review-only",
  "reviewedAt": "2026-07-07T00:00:00.000Z",
  "reviewedAtDefaulted": false,
  "classification": "valid_ci_enablement_boundary_map_workflows_present_ci_runtime_still_blocked",
  "ciEnablementBoundaryMapProduced": true,
  "boundaryEntries": [
    {
      "boundaryId": "phase5-79.github-actions.ci_workflow_files_created",
      "boundaryFamily": "ci_workflow_files_created",
      "relatedSystem": "github-actions",
      "currentStatus": "active",
      "allowedCurrentBehavior": [
        "Record that ci.yml and security.yml were created per the 5.78 contract.",
        "CI executes the existing validation suite (npm test, cargo test, etc.).",
        "CI is check-execution only — NOT product runtime."
      ],
      "forbiddenCurrentBehavior": [
        "Execute any blocked runtime surface via CI.",
        "Publish, deploy, write to the repo, or auto-merge.",
        "Use secrets or set fabric env variables."
      ],
      "requiredFutureContractBeforeImplementation": [],
      "requiredFutureAuthorizationPhaseBeforeRuntime": "none (CI is active, not runtime-blocked)",
      "contractShape": {
        "workflowFiles": "array [ci.yml, security.yml] (present)",
        "triggers": "object (push, pull_request, schedule, workflow_dispatch)",
        "permissions": "object (contents: read)",
        "secrets": "array (empty)"
      },
      "crossPhaseReferences": [
        "5.78 (CI enforcement contract — the spec this phase implements)"
      ],
      "explicitBlockedAuthorizationFlags": {
        "runtimeAuthorized": false,
        "authorizesRuntime": false,
        "ciExecutionAuthorizationGranted": false,
        "ciPublishAuthorizationGranted": false,
        "ciDeployAuthorizationGranted": false,
        "ciWriteToRepoAuthorizationGranted": false,
        "ciSecretUseAuthorizationGranted": false,
        "ciTokenMintAuthorizationGranted": false,
        "ciAutoMergeAuthorizationGranted": false,
        "semgrepGateAuthorizationGranted": false,
        "fabricSecretInCiAuthorizationGranted": false,
        "commandExposureAuthorizationGranted": false,
        "approvalDecisionProduced": false,
        "approvalGrantProduced": false
      },
      "unsafeCiEnablementRuntimeFlags": {
        "runtimeExecutionEnabled": false,
        "runtimeAuthorizationEnabled": false,
        "runtimeCommandEnabled": false,
        "commandExposureEnabled": false,
        "commandsExposed": false,
        "connectorGrantProduced": false,
        "ciRuntimeEnabled": false,
        "ciExecutionEnabled": false,
        "workflowExecutionEnabled": false,
        "ciPublishedArtifacts": false,
        "ciDeployEnabled": false,
        "ciWriteToRepoEnabled": false,
        "ciSecretUsed": false,
        "ciTokenMinted": false,
        "ciAutoMergeEnabled": false,
        "semgrepGateEnabled": false,
        "fabricSecretInCiEnabled": false,
        "fabricSidecarContactEnabled": false,
        "shellRuntimeEnabled": false,
        "sqliteRuntimeEnabled": false,
        "embeddedDbReaderEnabled": false,
        "databaseClientImplemented": false,
        "matrixClientRuntimeEnabled": false,
        "externalGatewayRuntimeEnabled": false,
        "fabricCoreTransportRuntimeEnabled": false,
        "fabricRuntimeImplementedByArdyn": false,
        "secureDropImplemented": false,
        "secureDropDecryptionEnabled": false,
        "filesystemAccessEnabled": false,
        "filesystemReadEnabled": false,
        "filesystemWriteEnabled": false,
        "backendRuntimeImplementedByArdyn": false,
        "processSpawnEnabled": false,
        "processControlEnabled": false,
        "blockedCliBypassEnabled": false
      },
      "runtimeEffect": {
        "runtimeEnabled": false,
        "runtimeStarted": false,
        "runtimeReady": false,
        "runtimeCommandEnabled": false,
        "runtimeCommandExposureEnabled": false,
        "runtimeExecutionEnabled": false,
        "runtimeExecuted": false,
        "approvalGrantProduced": false,
        "approvalGrantPersisted": false,
        "approvalEvaluatorAuthoritative": false
      },
      "nonAuthorizingProof": true,
      "ciEnablementBoundaryMetadataOnly": true,
      "noLiveCiEnablementRuntimePerformed": true
    },
    {
      "boundaryId": "phase5-79.github-actions.ci_job_matrix_enabled",
      "boundaryFamily": "ci_job_matrix_enabled",
      "relatedSystem": "github-actions",
      "currentStatus": "active",
      "allowedCurrentBehavior": [
        "Record that the CI job matrix (node, rust, node-windows) is enabled."
      ],
      "forbiddenCurrentBehavior": [
        "Add jobs beyond node, rust, and node-windows.",
        "Execute blocked runtime surfaces in any job."
      ],
      "requiredFutureContractBeforeImplementation": [],
      "requiredFutureAuthorizationPhaseBeforeRuntime": "none (CI jobs are active)",
      "contractShape": {
        "jobs": "array [node, rust, node-windows]",
        "nodeJob": "object (ubuntu, npm ci, node --test)",
        "rustJob": "object (ubuntu, fmt, clippy, test)",
        "nodeWindowsJob": "object (windows, npm ci, node --test)"
      },
      "clippyScopeSupersedes578AllTargets": {
        "contractValue": "--workspace --all-targets",
        "implementedValue": "--workspace",
        "reason": "--all-targets surfaces pre-existing explicit_counter_loop lint in lib.rs test code; fix requires editing lib.rs and breaking ~40 historical source-baseline tests",
        "deferredTo": "future clippy-scope hardening slice (with 5.82 source-guard de-brittling)"
      },
      "crossPhaseReferences": [
        "5.78 (ci_job_matrix contract)"
      ],
      "explicitBlockedAuthorizationFlags": {
        "runtimeAuthorized": false,
        "authorizesRuntime": false,
        "ciExecutionAuthorizationGranted": false,
        "ciPublishAuthorizationGranted": false,
        "ciDeployAuthorizationGranted": false,
        "ciWriteToRepoAuthorizationGranted": false,
        "ciSecretUseAuthorizationGranted": false,
        "ciTokenMintAuthorizationGranted": false,
        "ciAutoMergeAuthorizationGranted": false,
        "semgrepGateAuthorizationGranted": false,
        "fabricSecretInCiAuthorizationGranted": false,
        "commandExposureAuthorizationGranted": false,
        "approvalDecisionProduced": false,
        "approvalGrantProduced": false
      },
      "unsafeCiEnablementRuntimeFlags": {
        "runtimeExecutionEnabled": false,
        "runtimeAuthorizationEnabled": false,
        "runtimeCommandEnabled": false,
        "commandExposureEnabled": false,
        "commandsExposed": false,
        "connectorGrantProduced": false,
        "ciRuntimeEnabled": false,
        "ciExecutionEnabled": false,
        "workflowExecutionEnabled": false,
        "ciPublishedArtifacts": false,
        "ciDeployEnabled": false,
        "ciWriteToRepoEnabled": false,
        "ciSecretUsed": false,
        "ciTokenMinted": false,
        "ciAutoMergeEnabled": false,
        "semgrepGateEnabled": false,
        "fabricSecretInCiEnabled": false,
        "fabricSidecarContactEnabled": false,
        "shellRuntimeEnabled": false,
        "sqliteRuntimeEnabled": false,
        "embeddedDbReaderEnabled": false,
        "databaseClientImplemented": false,
        "matrixClientRuntimeEnabled": false,
        "externalGatewayRuntimeEnabled": false,
        "fabricCoreTransportRuntimeEnabled": false,
        "fabricRuntimeImplementedByArdyn": false,
        "secureDropImplemented": false,
        "secureDropDecryptionEnabled": false,
        "filesystemAccessEnabled": false,
        "filesystemReadEnabled": false,
        "filesystemWriteEnabled": false,
        "backendRuntimeImplementedByArdyn": false,
        "processSpawnEnabled": false,
        "processControlEnabled": false,
        "blockedCliBypassEnabled": false
      },
      "runtimeEffect": {
        "runtimeEnabled": false,
        "runtimeStarted": false,
        "runtimeReady": false,
        "runtimeCommandEnabled": false,
        "runtimeCommandExposureEnabled": false,
        "runtimeExecutionEnabled": false,
        "runtimeExecuted": false,
        "approvalGrantProduced": false,
        "approvalGrantPersisted": false,
        "approvalEvaluatorAuthoritative": false
      },
      "nonAuthorizingProof": true,
      "ciEnablementBoundaryMetadataOnly": true,
      "noLiveCiEnablementRuntimePerformed": true
    },
    {
      "boundaryId": "phase5-79.github-actions.security_workflow_enabled",
      "boundaryFamily": "security_workflow_enabled",
      "relatedSystem": "github-actions",
      "currentStatus": "active",
      "allowedCurrentBehavior": [
        "Record that the security workflow (npm audit, cargo audit, osv-scanner) is enabled.",
        "Security scans run weekly on a cron schedule."
      ],
      "forbiddenCurrentBehavior": [
        "Run security scans as PR-blocking gates.",
        "Use secrets in the security workflow."
      ],
      "requiredFutureContractBeforeImplementation": [],
      "requiredFutureAuthorizationPhaseBeforeRuntime": "none (security workflow is active)",
      "contractShape": {
        "checks": "array [npm audit, cargo audit, osv-scanner]",
        "trigger": "string 'schedule'",
        "blocksPRs": "boolean false"
      },
      "crossPhaseReferences": [
        "5.78 (security_workflow_scope contract)"
      ],
      "explicitBlockedAuthorizationFlags": {
        "runtimeAuthorized": false,
        "authorizesRuntime": false,
        "ciExecutionAuthorizationGranted": false,
        "ciPublishAuthorizationGranted": false,
        "ciDeployAuthorizationGranted": false,
        "ciWriteToRepoAuthorizationGranted": false,
        "ciSecretUseAuthorizationGranted": false,
        "ciTokenMintAuthorizationGranted": false,
        "ciAutoMergeAuthorizationGranted": false,